{
 "schema_version": "1.0",
 "as_of": "2031-02-28",
 "mode": "supervised",
 "findings": [
  {
   "id": "waived_but_billed:CDU-3051259",
   "class": "waived_but_billed",
   "variant": "WB-01",
   "verdict": "finding",
   "amount_usd": "52.70",
   "amount_range": null,
   "deadline": null,
   "action": "draft:dispute",
   "confidence": 0.95,
   "evidence": [
    {
     "doc": "batch_01/0007.eml",
     "page": 1,
     "quote": "Please treat the Delivery fee on AWB CA10343321 as waived."
    },
    {
     "doc": "batch_01/0008.eml#CDU-3051259.pdf",
     "page": 1,
     "quote": "USE2-INS2 CA10343321 Delivery fee 1 shpt 52.70 52.70 07/06/2030"
    },
    {
     "doc": "batch_01/0003.eml#MSA-CDA-US-EXP-E91.pdf",
     "page": 11,
     "quote": "Thea Kapadia, Customer Finance Lead, CDA-US: waivers, payment_terms <thea.kapadia@caldrith.example>"
    }
   ],
   "missing_doc": null,
   "supersedes": [],
   "learned_at": null,
   "invoice_id": "CDU-3051259"
  },
  {
   "id": "overcharge:CDU-3051266",
   "class": "overcharge",
   "variant": "OC-01",
   "verdict": "finding",
   "amount_usd": "244.37",
   "amount_range": null,
   "deadline": null,
   "action": "draft:dispute",
   "confidence": 0.95,
   "evidence": [
    {
     "doc": "batch_01/0010.eml#CDU-3051266.pdf",
     "page": 1,
     "quote": "USC1-INW1 CA53442004 Air freight 547 kg 7.16 3,916.52 19/06/2030"
    },
    {
     "doc": "batch_01/0003.eml#MSA-CDA-US-EXP-E91.pdf",
     "page": 8,
     "quote": "USC1-INW1 300+ kg 6.79 7.24"
    },
    {
     "doc": "batch_01/0016.eml#tracking-2030-01-01.xlsx",
     "page": 1,
     "quote": "CA53442004 | PICKED_UP | 2030-06-19 | USC1 | -"
    }
   ],
   "missing_doc": null,
   "supersedes": [],
   "learned_at": null,
   "invoice_id": "CDU-3051266"
  },
  {
   "id": "late_fee_not_owed:CDU-3051277",
   "class": "late_fee_not_owed",
   "variant": "LF-01",
   "verdict": "finding",
   "amount_usd": "21.58",
   "amount_range": null,
   "deadline": null,
   "action": "draft:dispute",
   "confidence": 0.95,
   "evidence": [
    {
     "doc": "batch_01/0011.eml",
     "page": 1,
     "quote": "Invoice CDU-3051262 now falls due on 2030-07-25 (extended under clause 10.5)."
    },
    {
     "doc": "batch_02/0023.eml#ap-register-2031-02-28.xlsx",
     "page": 1,
     "quote": "CDU-3051262 | 2030-06-15 | due 2030-07-15 | USD 1448.48 | paid | 2030-07-23"
    },
    {
     "doc": "batch_01/0015.eml#CDU-3051277.pdf",
     "page": 1,
     "quote": "- - Late fee on CDU-3051262: USD 1448.48 overdue, month 1 @ 1.49% 1 month 1.49% 21.58 -"
    }
   ],
   "missing_doc": null,
   "supersedes": [],
   "learned_at": null,
   "invoice_id": "CDU-3051277"
  },
  {
   "id": "overcharge:CDU-3051286",
   "class": "overcharge",
   "variant": "XC-02",
   "verdict": "cannot_determine",
   "amount_usd": null,
   "amount_range": null,
   "deadline": null,
   "action": "draft:request_document",
   "confidence": 0.9,
   "evidence": [
    {
     "doc": "batch_01/0004.eml#CDA-US-EXP-E91-AMD-1.pdf",
     "page": 1,
     "quote": "2. The Annex A rates for lane(s) USW2-USW1 are deleted and replaced as follows: Annex A rev 2 (attached) applies from"
    }
   ],
   "missing_doc": {
    "name": "Annex A rev 2",
    "holder": {
     "party": "CDA-US",
     "person": "Joaquin Rathbone",
     "role": "Pricing Manager"
    }
   },
   "supersedes": [],
   "learned_at": null,
   "invoice_id": "CDU-3051286"
  },
  {
   "id": "overcharge:CDU-3051297",
   "class": "overcharge",
   "variant": "OC-02",
   "verdict": "finding",
   "amount_usd": "155.65",
   "amount_range": null,
   "deadline": null,
   "action": "draft:dispute",
   "confidence": 0.95,
   "evidence": [
    {
     "doc": "batch_02/0004.eml#CDU-3051297.pdf",
     "page": 1,
     "quote": "USE2-INS2 CA24035181 DG handling 1 shpt 155.65 155.65 20/09/2030"
    },
    {
     "doc": "batch_02/0004.eml#DGD-CA24035181.pdf",
     "page": 1,
     "quote": "UN1845 Dry ice 18.6 kg - refrigerant only"
    }
   ],
   "missing_doc": null,
   "supersedes": [],
   "learned_at": null,
   "invoice_id": "CDU-3051297"
  },
  {
   "id": "overcharge:CDU-3051302",
   "class": "overcharge",
   "variant": "XC-01",
   "verdict": "conflict",
   "amount_usd": null,
   "amount_range": [
    "0.00",
    "61.93"
   ],
   "deadline": null,
   "action": "escalate",
   "confidence": 0.9,
   "evidence": [
    {
     "doc": "batch_01/0004.eml#CDA-US-EXP-E91-AMD-1.pdf",
     "page": 1,
     "quote": "USE2-USC3 100-299.5 kg 3.99 USD"
    },
    {
     "doc": "batch_02/0001.eml",
     "page": 1,
     "quote": "USE2-USC3 minimum charge = USD 85.98"
    }
   ],
   "missing_doc": null,
   "supersedes": [],
   "learned_at": null,
   "invoice_id": "CDU-3051302"
  },
  {
   "id": "waived_but_billed:CDU-3051323",
   "class": "waived_but_billed",
   "variant": "WB-01",
   "verdict": "finding",
   "amount_usd": "52.70",
   "amount_range": null,
   "deadline": null,
   "action": "draft:dispute",
   "confidence": 0.95,
   "evidence": [
    {
     "doc": "batch_02/0009.eml",
     "page": 1,
     "quote": "The Delivery fee billed against AWB CA75329761 is waived, with our apologies."
    },
    {
     "doc": "batch_02/0011.eml#CDU-3051323.pdf",
     "page": 1,
     "quote": "USE2-INW1 CA75329761 Delivery fee 1 shpt 52.70 52.70 14/10/2030"
    },
    {
     "doc": "batch_01/0003.eml#MSA-CDA-US-EXP-E91.pdf",
     "page": 11,
     "quote": "Thea Kapadia, Customer Finance Lead, CDA-US: waivers, payment_terms <thea.kapadia@caldrith.example>"
    }
   ],
   "missing_doc": null,
   "supersedes": [],
   "learned_at": null,
   "invoice_id": "CDU-3051323"
  },
  {
   "id": "overcharge:CDI-3031-0306",
   "class": "overcharge",
   "variant": "OC-01",
   "verdict": "finding",
   "amount_usd": "85.46",
   "amount_range": null,
   "deadline": null,
   "action": "draft:dispute",
   "confidence": 0.95,
   "evidence": [
    {
     "doc": "batch_02/0016.eml#CDI-3031-0306.pdf",
     "page": 1,
     "quote": "INE2-USWI CA68214550 Air freight 274 kg 330.42 90,535.08 06/01/2031"
    },
    {
     "doc": "batch_01/0001.eml#MSA-CDA-IN-EXP-E91.pdf",
     "page": 8,
     "quote": "INE2-USW1 100-299.5 kg 323.51 308.76"
    },
    {
     "doc": "batch_02/0022.eml#tracking-2030-09-01.xlsx",
     "page": 1,
     "quote": "CA68214550 | PICKED_UP | 2031-01-06 | INE2 | -"
    }
   ],
   "missing_doc": null,
   "supersedes": [],
   "learned_at": null,
   "invoice_id": "CDI-3031-0306"
  },
  {
   "id": "duplicate:CDU-3051273",
   "class": "duplicate",
   "variant": "DU-01",
   "verdict": "finding",
   "amount_usd": "3235.24",
   "amount_range": null,
   "deadline": null,
   "action": "draft:dispute",
   "confidence": 0.95,
   "evidence": [
    {
     "doc": "batch_02/0023.eml#ap-register-2031-02-28.xlsx",
     "page": 1,
     "quote": "CDU-3051273 | 2030-07-29 | due 2030-08-28 | USD 3235.24 | paid | 2030-08-27"
    },
    {
     "doc": "batch_01/0017.eml",
     "page": 1,
     "quote": "Our records show invoice CDU-3051273 as outstanding."
    }
   ],
   "missing_doc": null,
   "supersedes": [],
   "learned_at": null,
   "invoice_id": "CDU-3051273"
  }
 ],
 "portfolio": {
  "cashback": [
   {
    "id": "cashback:CDA-US-EXP-E91/2030-Q3/rebate",
    "class": "cashback",
    "variant": "CB-01",
    "verdict": "finding",
    "amount_usd": "4469.10",
    "amount_range": null,
    "deadline": null,
    "action": "draft:claim_credit",
    "confidence": 0.95,
    "evidence": [
     {
      "doc": "batch_01/0003.eml#MSA-CDA-US-EXP-E91.pdf",
      "page": 2,
      "quote": "7 Volume rebate 4"
     },
     {
      "doc": "batch_01/0003.eml#MSA-CDA-US-EXP-E91.pdf",
      "page": 3,
      "quote": "1.1 Qualifying Spend. Qualifying Spend means freight charges (base freight, fuel, security surcharge and Annex D"
     }
    ],
    "missing_doc": null,
    "supersedes": [],
    "learned_at": null,
    "contract_id": "CDA-US-EXP-E91",
    "period": "2030-Q3",
    "credit_type": "rebate"
   }
  ],
  "expiry": [
   {
    "id": "expiry:CDA-US-EXP-E91",
    "class": "expiry",
    "variant": "EX-01",
    "verdict": "finding",
    "amount_usd": null,
    "amount_range": null,
    "deadline": "2031-04-01",
    "action": "internal:alert",
    "confidence": 0.95,
    "evidence": [
     {
      "doc": "batch_01/0003.eml#MSA-CDA-US-EXP-E91.pdf",
      "page": 3,
      "quote": "2.2 Initial term. The initial term runs for 12 months and expires on 2031-04-01."
     }
    ],
    "missing_doc": null,
    "supersedes": [],
    "learned_at": null,
    "contract_id": "CDA-US-EXP-E91"
   }
  ],
  "late_fee_risk": [
   {
    "id": "late_fee_risk:CDU-3151571",
    "class": "late_fee_risk",
    "variant": "LF-03",
    "verdict": "finding",
    "amount_usd": "10.29",
    "amount_range": null,
    "deadline": "2031-03-10",
    "action": "internal:payment_reminder",
    "confidence": 0.95,
    "evidence": [
     {
      "doc": "batch_02/0023.eml#ap-register-2031-02-28.xlsx",
      "page": 1,
      "quote": "CDU-3151571 | 2031-02-08 | due 2031-03-10 | USD 690.34 | open | -"
     },
     {
      "doc": "batch_01/0003.eml#MSA-CDA-US-EXP-E91.pdf",
      "page": 4,
      "quote": "10.2 Late fee. Undisputed amounts outstanding for more than 0 days past the due date incur a late fee of 1.49% per month or"
     }
    ],
    "missing_doc": null,
    "supersedes": [],
    "learned_at": null,
    "invoice_id": "CDU-3151571"
   }
  ]
 }
}
